{
  "schema_version": "account_order_detail_panel.v1",
  "workbench": "Account Workbench",
  "panel": "Account Order Detail Panel",
  "route": "/accounts/{account_id}/orders/{client_order_id}",
  "fixture_state": "filled_lifecycle",
  "context": {
    "trading_day": "2026-06-14",
    "session_id": "account-workbench.fixture.20260614.003",
    "run_id": "account-order-detail.fixture.e100-filled.001",
    "reducer_checkpoint_id": "account-order-detail.checkpoint.e100.001",
    "reducer_checkpoint_ts": "2026-06-14T14:31:38Z",
    "stream_state": "healthy",
    "projection_owner": "account-console-contracts",
    "source_authority": "deterministic_fixture"
  },
  "account": {
    "account_id": "acct.demo-19053",
    "account_alias": "19053",
    "account_kind": "real_feed_sandbox_paper"
  },
  "order": {
    "account_id": "acct.demo-19053",
    "client_order_id": "p077-e100-rb2610-closeyesterday",
    "instrument": "rb2610",
    "side": "SELL",
    "offset": "CLOSEYESTERDAY",
    "order_type": "LIMIT",
    "limit_price": 3158.0,
    "quantity": 1,
    "filled_quantity": 1,
    "remaining_quantity": 0,
    "status": "filled",
    "lifecycle_ref": "fixture://account-workbench/orders/p077-e100-rb2610-closeyesterday/lifecycle",
    "report_provenance_ref": "D:/Nautilus/nautilus_ctp_adapter/output/reports/p077-paper-lifecycle/20260614T130516Z/p077_t6_e100_bounded_paper_close_yesterday_filled_reconciled.json",
    "source_ref": "D:/Nautilus/nautilus_ctp_adapter/output/reports/p077-paper-lifecycle/20260614T130516Z/p077_t6_e100_bounded_paper_close_yesterday_filled_reconciled.json",
    "checksum": "sha256:698340f03f5eb6ca03aa3006d295024850bf2a53a5687dee1178df421c635dbc"
  },
  "events": [
    {
      "event_id": "p077-e100-rb2610-closeyesterday.accepted",
      "event_seq": 0,
      "event_type": "accepted",
      "event_ts": "2026-06-14T13:05:16Z",
      "quantity": 1,
      "price": 3158.0,
      "status": "accepted_for_projection",
      "source_ref": "D:/Nautilus/nautilus_strategies/docs/changes/20260614__paper__p077-safer-retry-lane/evidence/20260614T130116Z_formal_bounded_paper_close_yesterday_authorization_after_e98.json",
      "checksum": "sha256:9999999999999999999999999999999999999999999999999999999999999999",
      "authority": "authorization source ref only; not active authorization"
    },
    {
      "event_id": "p077-e100-rb2610-closeyesterday.filled",
      "event_seq": 1,
      "event_type": "filled",
      "event_ts": "2026-06-14T13:05:16Z",
      "quantity": 1,
      "price": 3158.0,
      "status": "filled_reconciled",
      "source_ref": "D:/Nautilus/nautilus_ctp_adapter/output/reports/p077-paper-lifecycle/20260614T130516Z/p077_t6_e100_bounded_paper_close_yesterday_filled_reconciled.json",
      "checksum": "sha256:698340f03f5eb6ca03aa3006d295024850bf2a53a5687dee1178df421c635dbc",
      "authority": "external owner lifecycle artifact projected read-only"
    }
  ],
  "report_provenance": [
    {
      "kind": "filled_reconciled_report",
      "owner": "nautilus_ctp_adapter",
      "source_ref": "D:/Nautilus/nautilus_ctp_adapter/output/reports/p077-paper-lifecycle/20260614T130516Z/p077_t6_e100_bounded_paper_close_yesterday_filled_reconciled.json",
      "checksum": "sha256:698340f03f5eb6ca03aa3006d295024850bf2a53a5687dee1178df421c635dbc",
      "authority": "external owner report provenance; raw payload is not Account Console truth"
    }
  ],
  "blockers": [],
  "source_refs": [
    {
      "kind": "order_lifecycle",
      "owner": "nautilus_ctp_adapter",
      "source_ref": "D:/Nautilus/nautilus_ctp_adapter/output/reports/p077-paper-lifecycle/20260614T130516Z/p077_t6_e100_bounded_paper_close_yesterday_filled_reconciled.json",
      "checksum": "sha256:698340f03f5eb6ca03aa3006d295024850bf2a53a5687dee1178df421c635dbc",
      "authority": "external owner artifact projected read-only"
    }
  ],
  "boundaries": {
    "read_only_projection": true,
    "runtime_truth": false,
    "account_truth": false,
    "order_truth": false,
    "ledger_truth": false,
    "ui_truth": false,
    "paper_ready": false,
    "live_ready": false,
    "broker_tradable": false,
    "admission_truth": false,
    "capital_truth": false,
    "action_controls": false
  },
  "rejection_rules": [
    "Reject this fixture as Account Console order truth; the external owner artifact remains the authority.",
    "Reject raw report payload text, screenshots, stdout or latest paths as lifecycle truth.",
    "Reject this fixture as permission to submit, cancel, replace or repair orders."
  ]
}
